{
  "$schema": "https://json-schema.org/draft/2020-12/schema", "title": "Canonical active ingredient", "type": "object", "additionalProperties": false,
  "required": ["schemaVersion", "entityType", "id", "typeTermKey", "classificationTermKeys", "regions", "nomenclature", "atcVetCode", "localizedContent"],
  "properties": {
    "schemaVersion": { "const": 1 }, "entityType": { "const": "active_ingredient" }, "id": { "$ref": "common.schema.json#/$defs/uuidV4" },
    "typeTermKey": { "$ref": "common.schema.json#/$defs/key" }, "classificationTermKeys": { "$ref": "common.schema.json#/$defs/stringArray" }, "regions": { "$ref": "common.schema.json#/$defs/stringArray" },
    "nomenclature": { "$ref": "common.schema.json#/$defs/nomenclature" }, "atcVetCode": { "oneOf": [{ "$ref": "common.schema.json#/$defs/nonEmptyText" }, { "type": "null" }] },
    "localizedContent": { "$ref": "common.schema.json#/$defs/localizedContent" }, "sectionStandardKey": { "$ref": "common.schema.json#/$defs/sectionStandardKey" },
    "media": { "$ref": "common.schema.json#/$defs/media" }
  }
}
